{"cases":[{"application":null,"id":"base","initial":{"allocation":{"circulation":"1000","deltaR1":"0","deltaT1":"0","fees":"1000","rewardPot":"1000"},"chunk":"2","pools":[{"blocks":"1","leader":{"amount":"50","credential":"key:07070707070707070707070707070707070707070707070707070707","kind":"leader","pool":"01010101010101010101010101010101010101010101010101010101"},"pool":"01010101010101010101010101010101010101010101010101010101","poolPot":"100","sigma":{"d":"10","n":"1"},"snapshot":{"cost":"7","margin":{"d":"3","n":"1"},"ownerStake":"20","owners":["03030303030303030303030303030303030303030303030303030303"],"pledge":"0","rewardAccount":"key:07070707070707070707070707070707070707070707070707070707","stake":"100"}},{"blocks":"1","leader":{"amount":"25","credential":"key:07070707070707070707070707070707070707070707070707070707","kind":"leader","pool":"02020202020202020202020202020202020202020202020202020202"},"pool":"02020202020202020202020202020202020202020202020202020202","poolPot":"100","sigma":{"d":"10","n":"1"},"snapshot":{"cost":"0","margin":{"d":"1","n":"0"},"ownerStake":"25","owners":["05050505050505050505050505050505050505050505050505050505"],"pledge":"0","rewardAccount":"key:07070707070707070707070707070707070707070707070707070707","stake":"100"}}]},"steps":[{"complete":null,"label":"start110","members":[],"phase":"Pulsing","remaining":[{"credential":"script:03030303030303030303030303030303030303030303030303030303","pool":"01010101010101010101010101010101010101010101010101010101","stake":"40"},{"credential":"key:03030303030303030303030303030303030303030303030303030303","pool":"01010101010101010101010101010101010101010101010101010101","stake":"20"},{"credential":"key:04040404040404040404040404040404040404040404040404040404","pool":"01010101010101010101010101010101010101010101010101010101","stake":"40"},{"credential":"key:05050505050505050505050505050505050505050505050505050505","pool":"02020202020202020202020202020202020202020202020202020202","stake":"25"},{"credential":"key:06060606060606060606060606060606060606060606060606060606","pool":"02020202020202020202020202020202020202020202020202020202","stake":"75"}]},{"complete":null,"label":"pulse111","members":[{"amount":"24","credential":"script:03030303030303030303030303030303030303030303030303030303","kind":"member","pool":"01010101010101010101010101010101010101010101010101010101"}],"phase":"Pulsing","remaining":[{"credential":"key:04040404040404040404040404040404040404040404040404040404","pool":"01010101010101010101010101010101010101010101010101010101","stake":"40"},{"credential":"key:05050505050505050505050505050505050505050505050505050505","pool":"02020202020202020202020202020202020202020202020202020202","stake":"25"},{"credential":"key:06060606060606060606060606060606060606060606060606060606","pool":"02020202020202020202020202020202020202020202020202020202","stake":"75"}]},{"complete":null,"label":"pulse112","members":[{"amount":"24","credential":"script:03030303030303030303030303030303030303030303030303030303","kind":"member","pool":"01010101010101010101010101010101010101010101010101010101"},{"amount":"24","credential":"key:04040404040404040404040404040404040404040404040404040404","kind":"member","pool":"01010101010101010101010101010101010101010101010101010101"}],"phase":"Pulsing","remaining":[{"credential":"key:06060606060606060606060606060606060606060606060606060606","pool":"02020202020202020202020202020202020202020202020202020202","stake":"75"}]},{"complete":null,"label":"pulse113","members":[{"amount":"24","credential":"script:03030303030303030303030303030303030303030303030303030303","kind":"member","pool":"01010101010101010101010101010101010101010101010101010101"},{"amount":"24","credential":"key:04040404040404040404040404040404040404040404040404040404","kind":"member","pool":"01010101010101010101010101010101010101010101010101010101"},{"amount":"75","credential":"key:06060606060606060606060606060606060606060606060606060606","kind":"member","pool":"02020202020202020202020202020202020202020202020202020202"}],"phase":"Pulsing","remaining":[]},{"complete":{"deltaF":"-1000","deltaR":"802","deltaT":"0","rewards":[{"amount":"24","credential":"script:03030303030303030303030303030303030303030303030303030303","kind":"member","pool":"01010101010101010101010101010101010101010101010101010101"},{"amount":"24","credential":"key:04040404040404040404040404040404040404040404040404040404","kind":"member","pool":"01010101010101010101010101010101010101010101010101010101"},{"amount":"75","credential":"key:06060606060606060606060606060606060606060606060606060606","kind":"member","pool":"02020202020202020202020202020202020202020202020202020202"},{"amount":"50","credential":"key:07070707070707070707070707070707070707070707070707070707","kind":"leader","pool":"01010101010101010101010101010101010101010101010101010101"},{"amount":"25","credential":"key:07070707070707070707070707070707070707070707070707070707","kind":"leader","pool":"02020202020202020202020202020202020202020202020202020202"}]},"label":"pulse114","members":null,"phase":"Complete","remaining":null},{"complete":{"deltaF":"-1000","deltaR":"802","deltaT":"0","rewards":[{"amount":"24","credential":"script:03030303030303030303030303030303030303030303030303030303","kind":"member","pool":"01010101010101010101010101010101010101010101010101010101"},{"amount":"24","credential":"key:04040404040404040404040404040404040404040404040404040404","kind":"member","pool":"01010101010101010101010101010101010101010101010101010101"},{"amount":"75","credential":"key:06060606060606060606060606060606060606060606060606060606","kind":"member","pool":"02020202020202020202020202020202020202020202020202020202"},{"amount":"50","credential":"key:07070707070707070707070707070707070707070707070707070707","kind":"leader","pool":"01010101010101010101010101010101010101010101010101010101"},{"amount":"25","credential":"key:07070707070707070707070707070707070707070707070707070707","kind":"leader","pool":"02020202020202020202020202020202020202020202020202020202"}]},"label":"pulse115","members":null,"phase":"Complete","remaining":null}]},{"application":null,"id":"empty","initial":{"allocation":{"circulation":"1000","deltaR1":"0","deltaT1":"0","fees":"1000","rewardPot":"1000"},"chunk":"1","pools":[]},"steps":[{"complete":null,"label":"start110","members":[],"phase":"Pulsing","remaining":[]},{"complete":{"deltaF":"-1000","deltaR":"1000","deltaT":"0","rewards":[]},"label":"pulse111","members":null,"phase":"Complete","remaining":null}]},{"application":null,"id":"partial-force","initial":{"allocation":{"circulation":"1000","deltaR1":"0","deltaT1":"0","fees":"1000","rewardPot":"1000"},"chunk":"2","pools":[{"blocks":"1","leader":{"amount":"50","credential":"key:07070707070707070707070707070707070707070707070707070707","kind":"leader","pool":"01010101010101010101010101010101010101010101010101010101"},"pool":"01010101010101010101010101010101010101010101010101010101","poolPot":"100","sigma":{"d":"10","n":"1"},"snapshot":{"cost":"7","margin":{"d":"3","n":"1"},"ownerStake":"20","owners":["03030303030303030303030303030303030303030303030303030303"],"pledge":"0","rewardAccount":"key:07070707070707070707070707070707070707070707070707070707","stake":"100"}},{"blocks":"1","leader":{"amount":"25","credential":"key:07070707070707070707070707070707070707070707070707070707","kind":"leader","pool":"02020202020202020202020202020202020202020202020202020202"},"pool":"02020202020202020202020202020202020202020202020202020202","poolPot":"100","sigma":{"d":"10","n":"1"},"snapshot":{"cost":"0","margin":{"d":"1","n":"0"},"ownerStake":"25","owners":["05050505050505050505050505050505050505050505050505050505"],"pledge":"0","rewardAccount":"key:07070707070707070707070707070707070707070707070707070707","stake":"100"}}]},"steps":[{"complete":null,"label":"start110","members":[],"phase":"Pulsing","remaining":[{"credential":"script:03030303030303030303030303030303030303030303030303030303","pool":"01010101010101010101010101010101010101010101010101010101","stake":"40"},{"credential":"key:03030303030303030303030303030303030303030303030303030303","pool":"01010101010101010101010101010101010101010101010101010101","stake":"20"},{"credential":"key:04040404040404040404040404040404040404040404040404040404","pool":"01010101010101010101010101010101010101010101010101010101","stake":"40"},{"credential":"key:05050505050505050505050505050505050505050505050505050505","pool":"02020202020202020202020202020202020202020202020202020202","stake":"25"},{"credential":"key:06060606060606060606060606060606060606060606060606060606","pool":"02020202020202020202020202020202020202020202020202020202","stake":"75"}]},{"complete":null,"label":"pulse111","members":[{"amount":"24","credential":"script:03030303030303030303030303030303030303030303030303030303","kind":"member","pool":"01010101010101010101010101010101010101010101010101010101"}],"phase":"Pulsing","remaining":[{"credential":"key:04040404040404040404040404040404040404040404040404040404","pool":"01010101010101010101010101010101010101010101010101010101","stake":"40"},{"credential":"key:05050505050505050505050505050505050505050505050505050505","pool":"02020202020202020202020202020202020202020202020202020202","stake":"25"},{"credential":"key:06060606060606060606060606060606060606060606060606060606","pool":"02020202020202020202020202020202020202020202020202020202","stake":"75"}]},{"complete":{"deltaF":"-1000","deltaR":"802","deltaT":"0","rewards":[{"amount":"24","credential":"script:03030303030303030303030303030303030303030303030303030303","kind":"member","pool":"01010101010101010101010101010101010101010101010101010101"},{"amount":"24","credential":"key:04040404040404040404040404040404040404040404040404040404","kind":"member","pool":"01010101010101010101010101010101010101010101010101010101"},{"amount":"75","credential":"key:06060606060606060606060606060606060606060606060606060606","kind":"member","pool":"02020202020202020202020202020202020202020202020202020202"},{"amou